Submission-Date,message,image
"2021-02-17 15:56:53","I love kimchi because no reason!",https://loveaboutfood.com/images/image-1.png
"2021-02-18 12:14:56","I love pad krapow because it gives me a good hit after eating it!",https://loveaboutfood.com/images/image-2.png
"2021-02-23 23:41:30","I love za'taar chicken pasta because my boyfriend made it for me <3",https://loveaboutfood.com/images/image-3.png
"2021-02-23 23:51:41","I love to cook for my cute boyfriend",https://loveaboutfood.com/images/image-4.png
"2021-02-23 23:53:47","Gnocchi are pillows of love",https://loveaboutfood.com/images/image-5.png
"2021-02-24 08:50:21","I love coffee because it gives me good morning vibes.",https://loveaboutfood.com/images/image-6.png
"2021-02-26 13:08:14","I love bananas because they are healthy and gives me good vibes",https://loveaboutfood.com/images/image-7.png
"2021-03-08 23:10:02","I love roast chicken because it is a hearty meal after a long day!",https://loveaboutfood.com/images/image-8.png
"2021-03-08 23:11:39","I love egg noodles with fried pork because it gives me the spirit to keep going.",https://loveaboutfood.com/images/image-9.png
"2021-03-08 23:24:50","I love braised beef because it reminds me of home.",https://loveaboutfood.com/images/image-10.png
"2021-03-08 23:47:50","I love coffee because this is my morning routine",https://loveaboutfood.com/images/image-11.png
"2021-03-09 00:16:10","I love corn cheese because it combines the best of both worlds",https://loveaboutfood.com/images/image-12.png
"2021-03-09 00:39:16","I love sweet potatoes because they remind me of the mother land",https://loveaboutfood.com/images/image-13.png
"2021-03-09 20:35:39","I love this fried pork because I can feel the love from my wife.",https://loveaboutfood.com/images/image-14.png
"2021-03-09 20:37:11","I love this ramen because It makes me remind the first trip to Japan.",https://loveaboutfood.com/images/image-15.png
"2021-03-09 20:38:09","I love this sasimi because I love fresh food.",https://loveaboutfood.com/images/image-16.png
"2021-03-09 21:26:34","I love chimac- fried chicken and beer coz it's my life refresher at night after work!",https://loveaboutfood.com/images/image-17.png
"2021-03-10 11:37:08","I love beef noodle soup because it makes my mouth water 😻",https://loveaboutfood.com/images/image-18.png
"2021-03-10 18:47:25","I love pineapple rice in a block!",https://loveaboutfood.com/images/image-19.png
"2021-03-11 11:35:37","I love everything because I’m foodie lover!",https://loveaboutfood.com/images/image-20.png
"2021-03-11 12:06:11","I love shakshuka 🤤🤤",https://loveaboutfood.com/images/image-21.png
"2021-03-11 12:07:36","My favourite ‘taco de mixiote’ from Mexico",https://loveaboutfood.com/images/image-22.png
"2021-03-11 13:20:33","I love gnocchi because they're soft pillows of deliciousness.",https://loveaboutfood.com/images/image-23.png
"2021-03-11 13:24:56","I love dim sums because they are pockets of noms!",https://loveaboutfood.com/images/image-24.png
"2021-03-11 13:27:49","I love korean chicken and cheese because it's gooey spicy chix that lingers",https://loveaboutfood.com/images/image-25.png
"2021-03-11 13:29:15","I love ox tongue in korean BBQ because it's soft, chewey and delicious",https://loveaboutfood.com/images/image-26.png
"2021-03-11 13:31:19","I love 蚵仔煎 because it tastes like the sea",https://loveaboutfood.com/images/image-27.png
"2021-03-11 13:33:58","I love my boyfriend's delicious crusty bread",https://loveaboutfood.com/images/image-28.png
"2021-03-11 15:01:24","I love ramen because it can come in many different variety and is super satisfying to eat",https://loveaboutfood.com/images/image-29.png
"2021-03-11 15:18:14","I love raw meat because taste different.",https://loveaboutfood.com/images/image-30.png
"2021-03-11 16:52:29","I love bingsu because it makes me happy",https://loveaboutfood.com/images/image-31.png
"2021-03-11 16:52:50","i love cheesecake because it's yommi",https://loveaboutfood.com/images/image-32.png
"2021-03-11 17:36:14","I love hainan chiken because it tastes great.",https://loveaboutfood.com/images/image-33.png
"2021-03-12 15:10:53","I love food because it fuels my adventures",https://loveaboutfood.com/images/image-34.png
"2021-03-15 17:32:12","I love Dosa because it’s a simple vegetarian dish full of flavour",https://loveaboutfood.com/images/image-35.png
"2021-03-16 11:06:55","I love sushi because it's delicious and easy to handle.",https://loveaboutfood.com/images/image-36.png
"2021-03-18 11:24:48","I love this food because my daughter loves it.",https://loveaboutfood.com/images/image-37.png
"2021-03-18 13:58:51","I love Paneer Butter Masala Dosa because it a cornerstone of Indian Cuisine.",https://loveaboutfood.com/images/image-38.png
"2021-03-22 09:58:47","I love tea, because I drink it with my nan",https://loveaboutfood.com/images/image-39.png
"2021-06-29 16:39:27","I love paella because it reminds me to the summers on the beach with my family",https://loveaboutfood.com/images/image-40.png
"2021-07-07 16:48:10","I love home made curry because it is a source of joy.",https://loveaboutfood.com/images/image-41.png
"2021-07-10 20:22:23","I love himbeeroulade because it reminds me to sunny summer afternoons in our garden",https://loveaboutfood.com/images/image-42.png
"2021-07-11 20:32:24","I love pizza because it is tasty",https://loveaboutfood.com/images/image-43.png
"2021-07-11 23:38:51","I love corn because it tastes of summer",https://loveaboutfood.com/images/image-44.png
"2021-07-12 00:26:35","Cappelletti from the food town in the food region of the food country ;-)",https://loveaboutfood.com/images/image-45.png