Submission-Date,message,image
"2021-02-17 15:56:53","I love kimchi because no reason!",https://form.taxi/download/SYTjFFUHMz7ZQhhv/external-content.duckduckgo.com.jpg
"2021-02-18 12:14:56","I love pad krapow because it gives me a good hit after eating it!",https://form.taxi/download/IoFECEscmudHe8d9/IMG_20210218_120442.jpg
"2021-02-23 23:41:30","I love za'taar chicken pasta because my boyfriend made it for me <3",https://form.taxi/download/lUNSjCeESWPtQG7f/photo_2021-02-22_18-29-47.jpg
"2021-02-23 23:51:41","I love to cook for my cute boyfriend",https://form.taxi/download/ZMMw8YSCX0W4lRvr/IMG_20210220_130947.jpg
"2021-02-23 23:53:47","Gnocchi are pillows of love",https://form.taxi/download/JJYztim5j5fXwL4y/IMG_20210217_200335_350.jpg